{
  "id": "mahindra-be-6",
  "displayName": "Mahindra BE 6",
  "familySlug": "mahindra-be-6",
  "vehicle": {
    "brand": "Mahindra",
    "model": "BE 6",
    "bodyType": "SUV",
    "familySlug": "mahindra-be-6"
  },
  "fields": {
    "brand": "Mahindra",
    "model": "BE 6",
    "bodyType": "SUV",
    "familySlug": "mahindra-be-6",
    "startingPrice": 1890000,
    "topVariantPrice": 2690000,
    "exShowroomPrice": 1890000,
    "batteryCapacityKwh": 59,
    "claimedRangeKm": 500,
    "rangeTestStandard": "MIDC",
    "acChargingKw": 11,
    "dcChargingKw": 150,
    "airbags": 6,
    "adas": true
  },
  "features": {
    "sunroof": true,
    "ventilatedSeats": true,
    "camera360": true,
    "connectedCar": true,
    "v2l": true,
    "v2v": false
  },
  "variants": [
    {
      "variantName": "Pack One 59",
      "priceInr": 1890000,
      "batteryKwh": 59,
      "rangeKm": 500,
      "acChargingKw": 11,
      "dcChargingKw": 150
    },
    {
      "variantName": "Pack Three 79",
      "priceInr": 2290000,
      "batteryKwh": 79,
      "rangeKm": 683,
      "acChargingKw": 11,
      "dcChargingKw": 150
    },
    {
      "variantName": "Pack Three 79 Select",
      "priceInr": 2690000,
      "batteryKwh": 79,
      "rangeKm": 683,
      "acChargingKw": 11,
      "dcChargingKw": 150
    }
  ],
  "verificationLevel": "manual_review",
  "sources": [
    "Mahindra OEM + ZigWheels (Jun 2026)"
  ],
  "verifiedAt": "2026-06-08"
}